{
  "$schema": "../source_provenance.schema.json",
  "schema_version": 1,
  "folder": ".",
  "description": "Authored mappings from federal polling booths to state seats.",
  "created_at_utc": "2026-07-23T23:22:02Z",
  "updated_at_utc": "2026-07-23T23:22:02Z",
  "categories": {
    "federal_state_booth_mappings": {
      "description": "Manual federal-booth to state-seat mappings used to derive fTransposedFederalSwing.",
      "file_patterns": [
        "booths-*.txt"
      ],
      "exclude_patterns": [],
      "semantic_revision": 1,
      "files": {
        "booths-2018sa.txt": {
          "sha256": "61470a8069a69b331592d7a9e0d385030c03a7b2f5d3813391c1838804dc7260",
          "size_bytes": 14577,
          "recorded_mtime_utc": "2022-12-31T07:36:50.977098Z"
        },
        "booths-2018vic.txt": {
          "sha256": "66016e2bd5331c4cb919a7ffee8f6979ed10f88fe9fabc8eba101ebc5ac5c1ef",
          "size_bytes": 42190,
          "recorded_mtime_utc": "2022-09-12T00:44:49.165193Z"
        },
        "booths-2019nsw.txt": {
          "sha256": "44528235e8bee1b4e3dcd68b19f31f4bfbd8ed2b12e138f7d70d2a4146c3ac7d",
          "size_bytes": 62747,
          "recorded_mtime_utc": "2022-09-13T00:24:51.570326Z"
        },
        "booths-2022sa.txt": {
          "sha256": "1ff5554dadc4e6cc5ad294f84e683cb5bc2d9ac2b0df268f8805342827c98439",
          "size_bytes": 14619,
          "recorded_mtime_utc": "2022-12-31T07:36:50.980100Z"
        },
        "booths-2022vic.txt": {
          "sha256": "c0c0d56c91f9a5389b83b7287ff993b6f812a8a8123cc0c68b0e96d195478e21",
          "size_bytes": 43528,
          "recorded_mtime_utc": "2022-09-04T08:57:12.565391Z"
        },
        "booths-2023nsw.txt": {
          "sha256": "7b18a1df4b48c16efe2c10958764d400956447c5d19475dadcd77c75873a10c9",
          "size_bytes": 65066,
          "recorded_mtime_utc": "2023-01-03T09:52:32.315161Z"
        },
        "booths-2026sa.txt": {
          "sha256": "02f329a5981c86565295f1dec98b72a40c2553fbc67742b73b120b948570279c",
          "size_bytes": 14690,
          "recorded_mtime_utc": "2025-11-04T08:42:41.758364Z"
        },
        "booths-2026vic.txt": {
          "sha256": "62727dcf3ce4f5b2561d6a8af1dc0cef8926c8f8c2d50f48c218a937c442c8f9",
          "size_bytes": 44901,
          "recorded_mtime_utc": "2025-11-08T08:00:09.502081Z"
        },
        "booths-2027nsw.txt": {
          "sha256": "70f5769cf4753fda065388184e412c21746c92792a85e0d95d9e493ecd5bb18c",
          "size_bytes": 67851,
          "recorded_mtime_utc": "2026-01-18T09:58:17.281597Z"
        }
      },
      "events": [
        {
          "id": "20260723T232202Z-baseline-federal-state-booth-mappings-99cb10c4",
          "recorded_at_utc": "2026-07-23T23:22:02Z",
          "change_type": "baseline",
          "magnitude": "unknown",
          "affects_outputs": true,
          "semantic_revision": 1,
          "summary": "Recorded the current authored source state as the initial provenance baseline; generated outputs were not reproduced or validated.",
          "files": [
            "booths-2018sa.txt",
            "booths-2018vic.txt",
            "booths-2019nsw.txt",
            "booths-2022sa.txt",
            "booths-2022vic.txt",
            "booths-2023nsw.txt",
            "booths-2026sa.txt",
            "booths-2026vic.txt",
            "booths-2027nsw.txt"
          ],
          "scope": {
            "all": true,
            "elections": [],
            "parties": [],
            "stages": []
          }
        }
      ]
    }
  }
}
